{
  "schemaVersion": 1,
  "protocol": "afterburner.ui",
  "revision": 1,
  "id": "audit-1",
  "type": "policy.decision",
  "actorKind": "policy",
  "actorId": "policy-engine",
  "surfaceId": "surface-1",
  "envelopeId": "envelope-1",
  "decision": "deny",
  "reason": "grant-required",
  "at": "2026-09-04T20:21:10Z",
  "attributes": {
    "extensionId": "extension-1",
    "capability": "ui.action.invoke",
    "resource": "action.submit",
    "grantEpoch": "2"
  }
}
